Name,Rate,Vote,Year,Director,Star,Summary
Hawkeye,7.9,72625.0,2021,,"Jeremy Renner, Hailee Steinfeld, Florence Pugh, Vera Farmiga","Series based on the Marvel Comics superhero Hawkeye, centering on the adventures of Young Avenger, Kate Bishop, who took on the role after the original Avenger, Clint Barton."
The Unforgivable,7.2,52091.0,2021,Nora Fingscheidt,"Sandra Bullock, Viola Davis, Vincent D'Onofrio, Jon Bernthal",A woman is released from prison after serving a sentence for a violent crime and re-enters a society that refuses to forgive her past.
Dexter: New Blood,8.9,30708.0,2021–2022,,"Michael C. Hall, Jack Alcott, Julia Jones, Johnny Sequoyah","Set 10 years after Dexter Morgan went missing in the eye of Hurricane Laura, he is now living under an assumed name in Upstate New York, Iron Lake, far from his original home in Miami."
The King's Man,6.8,2993.0,2021,Matthew Vaughn,"Ralph Fiennes, Gemma Arterton, Rhys Ifans, Harris Dickinson","In the early years of the 20th century, the Kingsman agency is formed to stand against a cabal plotting a war to wipe out millions."
Pushpa: The Rise - Part 1,8.2,17546.0,2021,Sukumar,"Allu Arjun, Fahadh Faasil, Rashmika Mandanna, Dhananjaya","Story of Pushpa Raj, a lorry driver in Seshachalam forests of South India, set in the backdrop of red sandalwood smuggling. Red Sandalwood is endemic to South-Eastern Ghats (mountain range) of India."
West Side Story,7.9,17364.0,2021,Steven Spielberg,"Ansel Elgort, Rachel Zegler, Ariana DeBose, David Alvarez","An adaptation of the 1957 musical, West Side Story explores forbidden love and the rivalry between the Jets and the Sharks, two teenage street gangs of different ethnic backgrounds."
Nightmare Alley,7.5,4415.0,2021,Guillermo del Toro,"Bradley Cooper, Cate Blanchett, Toni Collette, Willem Dafoe",An ambitious carny with a talent for manipulating people with a few well-chosen words hooks up with a female psychiatrist who is even more dangerous than he is.
Daredevil,8.6,391254.0,2015–2018,,"Charlie Cox, Vincent D'Onofrio, Deborah Ann Woll, Elden Henson","A blind lawyer by day, vigilante by night. Matt Murdock fights the crime of New York as Daredevil."
Death on the Nile,,,2022,Kenneth Branagh,"Kenneth Branagh, Gal Gadot, Tom Bateman, Rose Leslie","While on vacation on the Nile, Hercule Poirot must investigate the murder of a young heiress."
Money Heist,8.2,428091.0,2017–2021,,"Úrsula Corberó, Álvaro Morte, Itziar Ituño, Pedro Alonso",An unusual group of robbers attempt to carry out the most perfect robbery in Spanish history - stealing 2.4 billion euros from the Royal Mint of Spain.
House of Gucci,6.9,39667.0,2021,Ridley Scott,"Lady Gaga, Adam Driver, Al Pacino, Jeremy Irons","When Patrizia Reggiani, an outsider from humble beginnings, marries into the Gucci family, her unbridled ambition begins to unravel their legacy and triggers a reckless spiral of betrayal, decadence, revenge, and ultimately...murder."
Home Alone 2: Lost in New York,6.8,335087.0,1992,Chris Columbus,"Macaulay Culkin, Joe Pesci, Daniel Stern, Catherine O'Hara","One year after Kevin McCallister was left home alone and had to defeat a pair of bumbling burglars, he accidentally finds himself stranded in New York City - and the same criminals are not far behind."
Dexter,8.6,694015.0,2006–2013,,"Michael C. Hall, Jennifer Carpenter, David Zayas, James Remar","He's smart. He's lovable. He's Dexter Morgan, America's favorite serial killer, who spends his days solving crimes and nights committing them. Golden Globe winner Michael C. Hall stars in the hit SHOWTIME Original Series."
Titans,7.6,89402.0,2018,,"Brenton Thwaites, Anna Diop, Ryan Potter, Teagan Croft",A team of young superheroes combat evil and other perils.
The Batman,,,2022,Matt Reeves,"Robert Pattinson, Peter Sarsgaard, Andy Serkis, Zoë Kravitz","In his second year of fighting crime, Batman uncovers corruption in Gotham City that connects to his own family while facing a serial killer known as the Riddler."
Mayor of Kingstown,8.1,6057.0,2021,,"Jeremy Renner, Dianne Wiest, Hugh Dillon, Tobi Bamtefa","The McLusky family are power brokers tackling themes of systemic racism, corruption and inequality in Kingstown, Michigan, where the business of incarceration is the only thriving industry."
Peaky Blinders,8.8,434837.0,2013–2022,,"Cillian Murphy, Paul Anderson, Helen McCrory, Sophie Rundle","A gangster family epic set in 1900s England, centering on a gang who sew razor blades in the peaks of their caps, and their fierce boss Tommy Shelby."
Landscapers,7.2,3630.0,2021,,"Olivia Colman, David Thewlis, Kate O'Flynn, Dipo Ola",A devoted and mild-mannered British couple become the focus of an extraordinary investigation when two dead bodies are discovered in the back garden of a house in England.
Breaking Bad,9.4,1626328.0,2008–2013,,"Bryan Cranston, Aaron Paul, Anna Gunn, Betsy Brandt",A high school chemistry teacher diagnosed with inoperable lung cancer turns to manufacturing and selling methamphetamine in order to secure his family's future.
The Sopranos,9.2,352556.0,1999–2007,,"James Gandolfini, Lorraine Bracco, Edie Falco, Michael Imperioli","New Jersey mob boss Tony Soprano deals with personal and professional issues in his home and business life that affect his mental state, leading him to seek professional psychiatric counseling."
NCIS,7.7,134737.0,2003,,"Mark Harmon, David McCallum, Sean Murray, Pauley Perrette","The cases of the Naval Criminal Investigative Service's Washington, D.C. Major Case Response Team, led by Special Agent Leroy Jethro Gibbs."
You,7.7,211211.0,2018,,"Penn Badgley, Victoria Pedretti, Ambyr Childers, Elizabeth Lail","A dangerously charming, intensely obsessive young man goes to extreme measures to insert himself into the lives of those he is transfixed by."
The Blacklist,8.0,227495.0,2013,,"James Spader, Megan Boone, Diego Klattenhoff, Ryan Eggold","A new FBI profiler, Elizabeth Keen, has her entire life uprooted when a mysterious criminal, Raymond Reddington, who has eluded capture for decades, turns himself in and insists on speaking only to her."
Gomorrah,8.7,35066.0,2014–2021,,"Salvatore Esposito, Marco D'Amore, Ivana Lotito, Cristiana Dell'Anna",Ciro disregards tradition in his attempt to become the next boss of his crime syndicate. The internal power struggle puts him and his entire family's life at risk.
Wrath of Man,7.1,135200.0,2021,Guy Ritchie,"Jason Statham, Holt McCallany, Josh Hartnett, Rocci Williams","The plot follows H, a cold and mysterious character working at a cash truck company responsible for moving hundreds of millions of dollars around Los Angeles each week."
The Boys,8.7,331552.0,2019,,"Karl Urban, Jack Quaid, Antony Starr, Erin Moriarty",A group of vigilantes set out to take down corrupt superheroes who abuse their superpowers.
Criminal Minds,8.1,181942.0,2005–2020,,"Matthew Gray Gubler, Kirsten Vangsness, A.J. Cook, Joe Mantegna","The cases of the F.B.I. Behavioral Analysis Unit (B.A.U.), an elite group of profilers who analyze the nation's most dangerous serial killers and individual heinous crimes in an effort to anticipate their next moves before they strike again."
Law & Order: Special Victims Unit,8.0,95762.0,1999,,"Mariska Hargitay, Christopher Meloni, Ice-T, Dann Florek","This series follows the Special Victims Unit, a specially trained squad of detectives in the N.Y.P.D., who investigate sexually related crimes."
Cowboy Bebop,6.7,30361.0,2021,,"John Cho, Mustafa Shakir, Daniella Pineda, Elena Satine",A ragtag crew of bounty hunters chases down the galaxy's most dangerous criminals. They'll save the world - for the right price.
Better Call Saul,8.8,369241.0,2015–2022,,"Bob Odenkirk, Rhea Seehorn, Jonathan Banks, Patrick Fabian","The trials and tribulations of criminal lawyer Jimmy McGill in the time before he established his strip-mall law office in Albuquerque, New Mexico."
West Side Story,7.5,105901.0,1961,"Jerome Robbins, Robert Wise","Natalie Wood, George Chakiris, Richard Beymer, Russ Tamblyn","Two youngsters from rival New York City gangs fall in love, but tensions between their respective friends build toward tragedy."
The Dark Knight,9.0,2462708.0,2008,Christopher Nolan,"Christian Bale, Heath Ledger, Aaron Eckhart, Michael Caine","When the menace known as the Joker wreaks havoc and chaos on the people of Gotham, Batman must accept one of the greatest psychological and physical tests of his ability to fight injustice."
True Story,7.6,12482.0,2021,,"Kevin Hart, Wesley Snipes, William Catlett, Paul Adelstein",A tour stop in Kid's hometown of Philadelphia becomes a matter of life and death for one of the world's most famous comedians.
Castle,8.1,152614.0,2009–2016,,"Nathan Fillion, Stana Katic, Susan Sullivan, Jon Huertas","After a serial killer imitates the plots of his novels, successful mystery novelist Richard ""Rick"" Castle receives permission from the Mayor of New York City to tag along with an NYPD homicide investigation team for research purposes."
Aranyak,8.0,4494.0,2021,,"Parambrata Chattopadhyay, Ashutosh Rana, Raveena Tandon, Taneesha Joshi","Political ploys, personal agendas and a beastly myth all surface as two mismatched hill station cops navigate a web of suspects after a puzzling murder."
Ozark,8.4,222133.0,2017–2022,,"Jason Bateman, Laura Linney, Sofia Hublitz, Skylar Gaertner","A financial advisor drags his family from Chicago to the Missouri Ozarks, where he must launder money to appease a drug boss."
Bad Santa,7.0,141105.0,2003,Terry Zwigoff,"Billy Bob Thornton, Bernie Mac, Lauren Graham, John Ritter",A miserable conman and his partner pose as Santa and his Little Helper to rob department stores on Christmas Eve. But they run into problems when the conman befriends a troubled kid.
Brooklyn Nine-Nine,8.4,276177.0,2013–2021,,"Andy Samberg, Stephanie Beatriz, Terry Crews, Melissa Fumero","Comedy series following the exploits of Det. Jake Peralta and his diverse, lovable colleagues as they police the NYPD's 99th Precinct."
Lucifer,8.1,298661.0,2016–2021,,"Tom Ellis, Lauren German, Kevin Alejandro, D.B. Woodside",Lucifer Morningstar has decided he's had enough of being the dutiful servant in Hell and decides to spend some time on Earth to better understand humanity. He settles in Los Angeles - the City of Angels.
The Godfather,9.2,1730913.0,1972,Francis Ford Coppola,"Marlon Brando, Al Pacino, James Caan, Diane Keaton","The Godfather follows Vito Corleone, Don of the Corleone family, as he passes the mantel to his unwilling son, Michael."
Only Murders in the Building,8.1,50225.0,2021,,"Steve Martin, Martin Short, Selena Gomez, Aaron Dominguez",Three strangers who share an obsession with true crime suddenly find themselves caught up in one.
Riverdale,6.7,134722.0,2017,,"Lili Reinhart, Camila Mendes, Cole Sprouse, K.J. Apa","While navigating the troubled waters of romance, school and family, Archie and his gang become entangled in dark Riverdale mysteries."
The Wire,9.3,312355.0,2002–2008,,"Dominic West, Lance Reddick, Sonja Sohn, Wendell Pierce","The Baltimore drug scene, as seen through the eyes of drug dealers and law enforcement."
Power Book II: Ghost,6.9,5258.0,2020,,"Michael Rainey Jr., Method Man, Mary J. Blige, Shane Johnson",The journey of some of Power's most controversial characters.
Midsomer Murders,7.8,29687.0,1997,,"John Nettles, Jane Wymark, Barry Jackson, Neil Dudgeon",A veteran Detective Chief Inspector and his young Sergeant investigate murders around the regional community of Midsomer County.
The Wolf of Wall Street,8.2,1293505.0,2013,Martin Scorsese,"Leonardo DiCaprio, Jonah Hill, Margot Robbie, Matthew McConaughey","Based on the true story of Jordan Belfort, from his rise to a wealthy stock-broker living the high life to his fall involving crime, corruption and the federal government."
Fargo,8.9,352518.0,2014,,"Billy Bob Thornton, Martin Freeman, Allison Tolman, Colin Hanks","Various chronicles of deception, intrigue and murder in and around frozen Minnesota. Yet all of these tales mysteriously lead back one way or another to Fargo, North Dakota."
Narcos: Mexico,8.4,76803.0,2018–2021,,"Scoot McNairy, José María Yazpik, Alejandro Edda, Alfonso Dosal",The rise of the Guadalajara Cartel as an American DEA agent learns the danger of targeting narcos in Mexico.
The Rookie,8.0,30546.0,2018,,"Nathan Fillion, Alyssa Diaz, Richard T. Jones, Melissa O'Neil","Starting over isn't easy, especially for John Nolan who, after a life-altering incident, is pursuing his dream of joining the LAPD. As their oldest rookie, he's met with skepticism from those who see him as just a walking midlife crisis."
The Punisher,8.5,206349.0,2017–2019,,"Jon Bernthal, Amber Rose Revah, Ben Barnes, Jason R. Moore","After the murder of his family, Marine veteran Frank Castle becomes the vigilante known as ""The Punisher,"" with only one goal in mind: to avenge them."
