Name,Rate,Vote,Year,Director,Star,Summary
Spider-Man: No Way Home,8.9,284449.0,2021,Jon Watts,"Tom Holland, Zendaya, Benedict Cumberbatch, Jacob Batalon","With Spider-Man's identity now revealed, Peter asks Doctor Strange for help. When a spell goes wrong, dangerous foes from other worlds start to appear, forcing Peter to discover what it truly means to be Spider-Man."
The Witcher,8.2,404498.0,2019,,"Henry Cavill, Freya Allan, Anya Chalotra, Mimi Ndiweni","Geralt of Rivia, a solitary monster hunter, struggles to find his place in a world where people often prove more wicked than beasts."
The Wheel of Time,7.3,59036.0,2021,,"Rosamund Pike, Daniel Henney, Madeleine Madden, Zoë Robins","Set in a high fantasy world where magic exists, but only some can access it, a woman named Moiraine crosses paths with five young men and women. This sparks a dangerous, world-spanning journey. Based on the book series by Robert Jordan."
Encanto,7.4,31488.0,2021,"Jared Bush, Byron Howard, Charise Castro Smith","Stephanie Beatriz, María Cecilia Botero, John Leguizamo, Mauro Castillo",A young Colombian girl has to face the frustration of being the only member of her family without magical powers.
Doctor Strange in the Multiverse of Madness,,,2022,Sam Raimi,"Benedict Cumberbatch, Elizabeth Olsen, Rachel McAdams, Xochitl Gomez",Plot unknown. Sequel to the 2016 Marvel film 'Doctor Strange'.
It's a Wonderful Life,8.6,433803.0,1946,Frank Capra,"James Stewart, Donna Reed, Lionel Barrymore, Thomas Mitchell",An angel is sent from Heaven to help a desperately frustrated businessman by showing him what life would have been like if he had never existed.
Station Eleven,7.0,2265.0,2021–2022,,"Joe Pingue, Mackenzie Davis, Himesh Patel, Matilda Lawler","A post apocalyptic saga spanning multiple timelines, telling the stories of survivors of a devastating flu as they attempt to rebuild and reimagine the world anew while holding on to the best of what's been lost."
Arcane,9.2,116005.0,2021,,"Hailee Steinfeld, Kevin Alejandro, Jason Spisak, Harry Lloyd","Set in utopian Piltover and the oppressed underground of Zaun, the story follows the origins of two iconic League champions-and the power that will tear them apart."
How the Grinch Stole Christmas,6.2,233308.0,2000,Ron Howard,"Jim Carrey, Taylor Momsen, Kelley, Jeffrey Tambor","On the outskirts of Whoville lives a green, revenge-seeking Grinch who plans to ruin Christmas for all of the citizens of the town."
Daredevil,8.6,391254.0,2015–2018,,"Charlie Cox, Vincent D'Onofrio, Deborah Ann Woll, Elden Henson","A blind lawyer by day, vigilante by night. Matt Murdock fights the crime of New York as Daredevil."
Game of Thrones,9.2,1919680.0,2011–2019,,"Emilia Clarke, Peter Dinklage, Kit Harington, Lena Headey","Nine noble families fight for control over the lands of Westeros, while an ancient enemy returns after being dormant for millennia."
Elf,7.0,253708.0,2003,Jon Favreau,"Will Ferrell, James Caan, Bob Newhart, Zooey Deschanel","Raised as an over-sized elf, a human travels from the North Pole to NYC to meet his biological father who doesn't know he exists and is in desperate need of some Christmas spirit."
A Boy Called Christmas,6.7,16705.0,2021,Gil Kenan,"Maggie Smith, Isabella O'Sullivan, Joel Fry, Eden Lawrence","In this origin story of Father Christmas, an ordinary boy (with a loyal pet mouse and a reindeer at his side) sets out on an extraordinary adventure to find his father who is on a quest to discover the fabled village of Elfhelm."
The Santa Clause,6.5,110999.0,1994,John Pasquin,"Tim Allen, Judge Reinhold, Wendy Crewson, Eric Lloyd","When a man inadvertently makes Santa fall off of his roof on Christmas Eve, he finds himself magically recruited to take his place."
Shang-Chi and the Legend of the Ten Rings,7.5,265101.0,2021,Destin Daniel Cretton,"Simu Liu, Awkwafina, Tony Chiu-Wai Leung, Ben Kingsley","Shang-Chi, the master of weaponry-based Kung Fu, is forced to confront his past after being drawn into the Ten Rings organization."
The Grinch,6.4,64548.0,2018,"Yarrow Cheney, Scott Mosier","Benedict Cumberbatch, Cameron Seely, Rashida Jones, Pharrell Williams",A grumpy Grinch (Benedict Cumberbatch) plots to ruin Christmas for the village of Whoville.
Scrooged,7.0,96366.0,1988,Richard Donner,"Bill Murray, Karen Allen, John Forsythe, John Glover","A selfish, cynical television executive is haunted by three spirits bearing lessons on Christmas Eve."
The Polar Express,6.6,195595.0,2004,Robert Zemeckis,"Tom Hanks, Chris Coppola, Michael Jeter, Leslie Zemeckis","On Christmas Eve, a young boy embarks on a magical adventure to the North Pole on the Polar Express, while learning about friendship, bravery, and the spirit of Christmas."
Eternals,6.8,125230.0,2021,Chloé Zhao,"Gemma Chan, Richard Madden, Angelina Jolie, Salma Hayek","The saga of the Eternals, a race of immortal beings who lived on Earth and shaped its history and civilizations."
Titans,7.6,89402.0,2018,,"Brenton Thwaites, Anna Diop, Ryan Potter, Teagan Croft",A team of young superheroes combat evil and other perils.
Last Train to Christmas,6.1,1482.0,2021,Julian Kemp,"Michael Sheen, Cary Elwes, Nathalie Emmanuel, Katherine Kelly","Tony Towers is a local celebrity, a successful nightclub manager and he is engaged to a younger woman, Sue. Things get a little strange when he embarks upon the 3:17 to Nottingham for a Christmas family reunion."
Last Christmas,6.5,71196.0,2019,Paul Feig,"Madison Ingoldsby, Emma Thompson, Boris Isakovic, Lucy Miller","Kate is a young woman subscribed to bad decisions. Working as an elf in a year round Christmas store is not good for the wannabe singer. However, she meets Tom there. Her life takes a new turn. For Kate, it seems too good to be true."
The Mandalorian,8.8,379058.0,2019,,"Pedro Pascal, Carl Weathers, Barry Lowin, Gina Carano","The travels of a lone bounty hunter in the outer reaches of the galaxy, far from the authority of the New Republic."
Spider-Man: Into the Spider-Verse,8.4,451490.0,2018,"Bob Persichetti, Peter Ramsey, Rodney Rothman","Shameik Moore, Jake Johnson, Hailee Steinfeld, Mahershala Ali","Teen Miles Morales becomes the Spider-Man of his universe, and must join with five spider-powered individuals from other dimensions to stop a threat for all realities."
Harry Potter and the Sorcerer's Stone,7.6,720299.0,2001,Chris Columbus,"Daniel Radcliffe, Rupert Grint, Richard Harris, Maggie Smith","An orphaned boy enrolls in a school of wizardry, where he learns the truth about himself, his family and the terrible evil that haunts the magical world."
Fantastic Beasts: The Secrets of Dumbledore,,,2022,David Yates,"Alison Sudol, Mads Mikkelsen, Jude Law, Katherine Waterston",The third installment of the 'Fantastic Beasts and Where to Find Them' series which follows the adventures of Newt Scamander.
Ghostbusters: Afterlife,7.6,46910.0,2021,Jason Reitman,"Carrie Coon, Paul Rudd, Finn Wolfhard, Mckenna Grace","When a single mom and her two kids arrive in a small town, they begin to discover their connection to the original Ghostbusters and the secret legacy their grandfather left behind."
Free Guy,7.2,241491.0,2021,Shawn Levy,"Ryan Reynolds, Jodie Comer, Taika Waititi, Lil Rel Howery","A bank teller discovers that he's actually an NPC inside a brutal, open world video game."
Supernatural,8.4,416806.0,2005–2020,,"Jared Padalecki, Jensen Ackles, Jim Beaver, Misha Collins","Two brothers follow their father's footsteps as hunters, fighting evil supernatural beings of many kinds, including monsters, demons and gods that roam the earth."
Rumble,5.8,1965.0,2021,Hamish Grieve,"Geraldine Viswanathan, Will Arnett, Stephen A. Smith, Terry Crews","In a world where monster wrestling is a global sport and monsters are superstar athletes, teenage Winnie seeks to follow in her father's footsteps by coaching a loveable underdog monster into a champion."
The Santa Clause 2,5.7,55607.0,2002,Michael Lembeck,"Tim Allen, Spencer Breslin, Elizabeth Mitchell, Eric Lloyd","Scott Calvin has been a humble Santa Claus for nearly ten years, but it might come to an end if he doesn't find a Mrs. Claus."
The Christmas Chronicles,7.0,69489.0,2018,Clay Kaytis,"Kurt Russell, Darby Camp, Judah Lewis, Oliver Hudson","The story of sister and brother, Kate and Teddy Pierce, whose Christmas Eve plan to catch Santa Claus on camera turns into an unexpected journey that most kids could only dream about."
Stranger Things,8.7,944475.0,2016,,"Millie Bobby Brown, Finn Wolfhard, Winona Ryder, David Harbour","When a young boy disappears, his mother, a police chief and his friends must confront terrifying supernatural forces in order to get him back."
The Muppet Christmas Carol,7.7,56018.0,1992,Brian Henson,"Michael Caine, Dave Goelz, Steve Whitmire, Jerry Nelson",The Muppet characters tell their version of the classic tale of an old and bitter miser's redemption on Christmas Eve.
Loki,8.3,242599.0,2021,,"Tom Hiddleston, Owen Wilson, Gugu Mbatha-Raw, Sophia Di Martino",The mercurial villain Loki resumes his role as the God of Mischief in a new series that takes place after the events of “Avengers: Endgame.”
A Christmas Carol,6.8,110625.0,2009,Robert Zemeckis,"Jim Carrey, Gary Oldman, Colin Firth, Steve Valentine","An animated retelling of Charles Dickens' classic novel about a Victorian-era miser taken on a journey of self-redemption, courtesy of several mysterious Christmas apparitions."
Attack on Titan,9.0,265152.0,2013–2022,,"Yûki Kaji, Marina Inoue, Josh Grelle, Yui Ishikawa","After his hometown is destroyed and his mother is killed, young Eren Jaeger vows to cleanse the earth of the giant humanoid Titans that have brought humanity to the brink of extinction."
WandaVision,8.0,252551.0,2021,,"Elizabeth Olsen, Paul Bettany, Kathryn Hahn, Teyonah Parris","Blends the style of classic sitcoms with the MCU, in which Wanda Maximoff and Vision - two super-powered beings living their ideal suburban lives - begin to suspect that everything is not as it seems."
Krampus,6.2,70236.0,2015,Michael Dougherty,"Adam Scott, Toni Collette, David Koechner, Allison Tolman",A boy who has a bad Christmas accidentally summons a festive demon to his family home.
Demon Slayer: Kimetsu no Yaiba,8.7,60772.0,2019,,"Natsuki Hanae, Zach Aguilar, Hiro Shimono, Yoshitsugu Matsuoka","A family is attacked by demons and only two members survive - Tanjiro and his sister Nezuko, who is turning into a demon slowly. Tanjiro sets out to become a demon slayer to avenge his family and cure his sister."
Outlander,8.4,142212.0,2014,,"Caitriona Balfe, Sam Heughan, Duncan Lacroix, Sophie Skelton",An English combat nurse from 1945 is mysteriously swept back in time to 1743.
Miracle on 34th Street,6.6,35803.0,1994,Les Mayfield,"Richard Attenborough, Elizabeth Perkins, Dylan McDermott, J.T. Walsh",A lawyer and a little girl must prove that a man claiming to be Santa Claus is the real thing.
Gremlins,7.3,213399.0,1984,Joe Dante,"Zach Galligan, Phoebe Cates, Hoyt Axton, John Louie",A young man inadvertently breaks three important rules concerning his new pet and unleashes a horde of malevolently mischievous monsters on a small town.
The Witcher: Blood Origin,,,2022,,"Michelle Yeoh, Laurence O'Fuarain, Jacob Collins-Levy, Lenny Henry","Prequel to the Netflix series 'The Witcher', set in an elven world 1,200 years before the show, centering on the origins of the very first Witcher."
A Christmas Carol,8.1,22309.0,1951,Brian Desmond Hurst,"Alastair Sim, Jack Warner, Kathleen Harrison, Mervyn Johns","Ebenezer Scrooge, a curmudgeonly, miserly businessman, has no time for sentimentality and largely views Christmas as a waste of time. However, this Christmas Eve he will be visited by three spirits who will show him the errors of his ways."
Midnight Mass,7.7,85775.0,2021,,"Kate Siegel, Zach Gilford, Kristin Lehman, Samantha Sloyan","An isolated island community experiences miraculous events - and frightening omens - after the arrival of a charismatic, mysterious young priest."
Lucifer,8.1,298661.0,2016–2021,,"Tom Ellis, Lauren German, Kevin Alejandro, D.B. Woodside",Lucifer Morningstar has decided he's had enough of being the dutiful servant in Hell and decides to spend some time on Earth to better understand humanity. He settles in Los Angeles - the City of Angels.
The Lord of the Rings: The Fellowship of the Ring,8.8,1756044.0,2001,Peter Jackson,"Elijah Wood, Ian McKellen, Orlando Bloom, Sean Bean",A meek Hobbit from the Shire and eight companions set out on a journey to destroy the powerful One Ring and save Middle-earth from the Dark Lord Sauron.
Thor: Love and Thunder,,,2022,Taika Waititi,"Natalie Portman, Taika Waititi, Karen Gillan, Matt Damon",The sequel to Thor: Ragnarok and the fourth movie in the Thor saga.
A Christmas Carol,7.8,14509.0,1984,Clive Donner,"George C. Scott, Frank Finlay, Angela Pleasence, Edward Woodward",A bitter old miser who rationalizes his uncaring nature learns real compassion when three spirits visit him on Christmas Eve.
